,Company,Customer,Number_review,Language,Title,Date_review,Reply,Date_reply,Rating,Status,Experience Date
157,Cofidis,Iz,1 review,MA,Excellent service!!,"Aug 9, 2021","Bonjour Hind, merci, ça fait vraiment plaisir ! Nous ferons tout notre possible pour continuer à vous apporter satisfaction. A bientôt ! Sébastien de l'équipe Cofidis.","Aug 10, 2021",5,Invited,"Excellent service!!Date of experience: August 09, 2021"
158,Cofidis,STEPHANE JEUILLY,1 review,FR,Simple clair rapide,"Jul 20, 2021","Bonjour Stéphane, merci beaucoup pour votre note et votre commentaire. Je vous souhaite une belle journée. Sébastien de l'équipe Cofidis.","Jul 20, 2021",5,Invited,"Simple clair rapideDate of experience: July 20, 2021"
159,Cofidis,DYLAN BASTET,2 reviews,FR,Service excellent !,"Jul 7, 2021","Bonjour Dylan, Merci pour votre message. 😊 A bientôt ! Sébastien de l'équipe Cofidis. ","Jul 8, 2021",5,Invited,"Service excellent !Date of experience: July 07, 2021"
160,Cofidis,michel fernandez,5 reviews,FR,Super rapide,"Jun 30, 2021",Bonjour Michel et merci pour ce retour. C'est un plaisir de vous accompagner dans ce projet. A très vite pour d'autres demandes ! Lionel de l'équipe Cofidis.,"Jul 1, 2021",5,Invited,"Super rapideSuper rapide, merciDate of experience: June 30, 2021"
161,Cofidis,MAKUIZA KIMFUTA,1 review,FR,Super service !,"Jan 17, 2022","Bonjour MAKUIZA KIMFUTA,Merci pour votre retour. A très bientôt chez Cofidis ! Aïcha de l'équipe Cofidis.","Jan 18, 2022",5,Invited,"Super service !Date of experience: January 17, 2022"
162,Cofidis,THI THANH THAO PHAM,1 review,FR,Excellent service.,"Aug 11, 2021","Bonjour Thi Thanh Thao, je vous remercie de votre fidélité. Nous mettons tout en œuvre afin de vous apporter satisfaction. Bonne journée ! Sébastien de l'équipe Cofidis.","Aug 12, 2021",5,Invited,"Excellent service.Date of experience: August 11, 2021"
163,Cofidis,STEPHANIE BENOIT,1 review,FR,Simple et rapide,"Nov 24, 2021",Bonjour Stéphanie.Rapide et efficace ! Enorme merci. 💪🏻 Je vous souhaite une agréable journée. Antoine de l'équipe Cofidis.,"Nov 25, 2021",5,Invited,"Simple et rapideDate of experience: November 24, 2021"
164,Cofidis,IDRISS HOARAU,2 reviews,FR,Excellent service,"Sep 20, 2021","Bonjour Idriss, je vous remercie de votre fidélité. Nous mettons tout en œuvre afin de vous apporter satisfaction. Bonne journée ! Sébastien de l'équipe Cofidis.","Sep 21, 2021",5,Invited,"Excellent serviceDate of experience: September 20, 2021"
165,Cofidis,COLETTE LETEVE,1 review,FR,super plus aimable,"Jul 13, 2021","Bonjour Madame Letève Colette,Je suis ravie de lire votre témoignage. 😊 Bonne journée ! Jocelyne de l'équipe Cofidis.","Jul 16, 2021",5,Invited,"super plus aimableDate of experience: July 13, 2021"
166,Cofidis,GAEL NDUENGA-BANGU,1 review,FR,Suivie impeccable,"Jul 20, 2021","Bonjour Gael, merci beaucoup pour votre commentaire. Nous sommes heureux de vous proposer les solutions que vous attendiez. Belle soirée. Sébastien de l'équipe Cofidis.","Jul 22, 2021",5,Invited,"Suivie impeccableDate of experience: July 20, 2021"
167,Cofidis,EDUARDO TOME VALENTE,1 review,FR,Exelent service,"Nov 8, 2021",Bonjour Eduardo. Merci pour votre note et votre commentaire. A bientôt ! Emmanuelle de l'équipe Cofidis.,"Nov 10, 2021",5,Invited,"Exelent serviceDate of experience: November 08, 2021"
168,Cofidis,Mme Laurence AUBERT,3 reviews,FR,Parfait service.,"Aug 9, 2021","Bonjour Laurence, merci beaucoup pour votre message. A très vite ! Wahiba de l'équipe Cofidis.","Aug 10, 2021",5,Invited,"Parfait service.Date of experience: August 09, 2021"
169,Cofidis,RACHEL DERMANIAN,2 reviews,FR,Exellent service,"Aug 3, 2021","Bonjour Madame DERMANIAN,Je suis ravi de lire votre commentaire. Je vous remercie pour le partage de cette expérience qui vous a apporté satisfaction. Bonne journée ! Julien de l'équipe Cofidis.","Aug 3, 2021",5,Invited,"Exellent serviceDate of experience: July 29, 2021"
170,Cofidis,Vivi,1 review,FR,Excellent,"Aug 3, 2021",Bonjour Vivi. Merci pour votre message. 😊 A bientôt ! Alexia de l'équipe Cofidis. ,"Aug 3, 2021",5,Invited,"ExcellentExcellent.......Date of experience: August 03, 2021"
171,Cofidis,NATHALIE LIMBO,2 reviews,FR,Service au top,"Nov 9, 2021",Bonjour Nathalie. Je suis ravi de lire votre témoignage. 😊 Bonne journée ! Jérôme de l'équipe Cofidis.,"Nov 12, 2021",5,Invited,"Service au topDate of experience: November 09, 2021"
172,Cofidis,HENRY,3 reviews,FR,Rapide,"Jun 30, 2021",Bonjour Henry. Merci pour votre message. 😊 A bientôt ! Jérôme de l'équipe Cofidis. ,"Jun 30, 2021",5,Invited,"RapideRapide et simpleDate of experience: June 30, 2021"
173,Cofidis,Geoffroy LEANDRO,2 reviews,FR,Super,"Dec 21, 2021",Bonjour Geoffroy. Je suis ravi de lire votre témoignage. 😊 Bonne journée ! Jérôme de l'équipe Cofidis.,"Dec 22, 2021",5,Invited,"SuperSuper serviceDate of experience: December 21, 2021"
174,Cofidis,Samy,3 reviews,FR,Simple et rapide,"Jun 28, 2021","Bonjour Samy,Merci, ça fait vraiment plaisir ! Nous ferons tout notre possible pour continuer à vous apporter satisfaction. A bientôt ! Insaf de l'équipe Cofidis.","Jun 29, 2021",5,Invited,"Simple et rapideDate of experience: June 28, 2021"
175,Cofidis,NOUR EDDINE BOUCETTA,1 review,FR,Bon accueuil.,"Dec 4, 2021","Bonjour Nour Eddine, merci pour votre retour. A très bientôt chez Cofidis ! Wahiba de l'équipe Cofidis.","Dec 6, 2021",5,Invited,"Bon accueuil.Date of experience: December 04, 2021"
176,Cofidis,MARYLENE	HENRY,2 reviews,FR,Service exelent,"Aug 3, 2021","Bonjour Marylène, merci pour votre message. 😊 A bientôt ! Estelle de l'équipe Cofidis. ","Aug 3, 2021",5,Invited,"Service exelentDate of experience: August 03, 2021"
177,Cofidis,MALEK MARZOUKI,1 review,FR,Good,"Nov 24, 2021","Bonjour Monsieur Marzouki,Merci pour votre retour. A très bientôt chez Cofidis ! Jocelyne de l'équipe Cofidis. 😀","Nov 25, 2021",5,Invited,"GoodGood serviceDate of experience: November 24, 2021"
178,Cofidis,christian le malicot,2 reviews,FR,Service au top,"Jul 17, 2021","Bonjour Christian, merci pour votre message. 😊 A bientôt ! Sébastien de l'équipe Cofidis. ","Jul 20, 2021",5,Invited,"Service au topDate of experience: July 17, 2021"
179,Cofidis,JULIEN LAURENT,1 review,FR,service au top,"Jul 13, 2021","Bonjour Julien, je suis ravi de lire votre témoignage. 😊 Bonne journée ! Sébastien de l'équipe Cofidis.","Jul 16, 2021",5,Invited,"service au topDate of experience: July 13, 2021"
